{
  "project_id": "pentest-lab",
  "repository": "git@github.com:snitcherhack/pentest-lab.git",
  "ref": "main",
  "platform": "linux",
  "worker_id": "main-linux",
  "working_directory": "/home/deiv/Proyectos/pentest-lab",
  "runtime_directory": "/home/deiv/.local/state/dvk-hermes-projects/pentest-lab",
  "allowed_engines": [
    "codex",
    "claude",
    "hybrid"
  ],
  "default_engine": "auto",
  "engine_policy": "balanced-v1",
  "capabilities": [
    "git",
    "python"
  ],
  "task_type": "development",
  "execution_profile": "hermes",
  "human_gates": [
    "PENTEST_ACTIVE_SCAN_APPROVAL_REQUIRED"
  ],
  "idempotency_policy": "safe_retry",
  "timeout_seconds": 1800,
  "max_turns": 12
}
