{
  "project_id": "video-publisher",
  "repository": "file:///mnt/a/PROYECTOS/video-publisher",
  "ref": "main",
  "platform": "linux",
  "worker_id": "main-linux",
  "working_directory": "/home/deiv/Proyectos/video-publisher",
  "runtime_directory": "/home/deiv/.local/state/dvk-hermes-projects/video-publisher",
  "allowed_engines": [
    "codex",
    "claude",
    "hybrid"
  ],
  "default_engine": "auto",
  "engine_policy": "balanced-v1",
  "capabilities": [
    "git",
    "python",
    "image_qa"
  ],
  "task_type": "development",
  "execution_profile": "hermes",
  "human_gates": [
    "SOCIAL_PUBLICATION_APPROVAL_REQUIRED"
  ],
  "idempotency_policy": "safe_retry",
  "timeout_seconds": 1800,
  "max_turns": 12
}
