{
  "project_id": "deividk-ansible-packs-V2",
  "repository": "git@github.com:snitcherhack/deividk-ansible-packs-v2.git",
  "ref": "main",
  "platform": "linux",
  "worker_id": "main-linux",
  "working_directory": "/home/deiv/Proyectos/deividk-ansible-packs-V2",
  "runtime_directory": "/home/deiv/.local/state/dvk-hermes-projects/deividk-ansible-packs-V2",
  "allowed_engines": [
    "codex",
    "claude",
    "hybrid"
  ],
  "default_engine": "auto",
  "engine_policy": "balanced-v1",
  "capabilities": [
    "git",
    "python",
    "tests"
  ],
  "task_type": "development",
  "execution_profile": "hermes",
  "human_gates": [
    "INFRASTRUCTURE_APPLY_APPROVAL_REQUIRED"
  ],
  "idempotency_policy": "safe_retry",
  "timeout_seconds": 1800,
  "max_turns": 12
}
